{
  "title": "Refactor Note Detail State Architecture",
  "summary": "This session resolved state synchronization issues in the NoteDetail layout by introducing a dedicated Zustand UI slice and isolating API-driven Server Data Context. The team agreed to separate transient UI state from persistent server data to eliminate re-render cascades.",
  "topics": [
    {
      "name": "State Duplication",
      "insight": "Avoid maintaining duplicate note selection lists in both local workspace context and global Redux store. Single source of truth reduces sync bugs.",
      "status": "resolved"
    },
    {
      "name": "Audio Player Sync",
      "insight": "Keep audio controls inside the local view controller to prevent unnecessary parent component re-renders. Audio state is inherently transient.",
      "status": "ongoing"
    },
    {
      "name": "Server Data Caching",
      "insight": "React Query provides built-in deduplication and stale-while-revalidate. No need for a custom caching layer on top.",
      "status": "resolved"
    }
  ],
  "decisions": [
    {
      "decision": "Isolate UI states like collapse-expand toggles into a tab.slice.ts Zustand slice.",
      "reason": "Zustand slices allow fine-grained, selector-based renders without the boilerplate of Redux or the context-invalidation cascades of React Context.",
      "status": "approved"
    },
    {
      "decision": "Retain server-fetched model data in the existing NoteDetailContext.",
      "reason": "Allows us to keep existing data-fetching logic and hook caching in place without risk of regressions.",
      "status": "approved"
    },
    {
      "decision": "Use React Query for all new API integrations instead of custom fetch wrappers.",
      "reason": "React Query handles caching, retry, deduplication, and background refetching out of the box. Reduces custom code by ~60%.",
      "status": "proposed"
    }
  ],
  "actionItems": [
    {
      "task": "Create src/features/note/store/tab.slice.ts with collapse state",
      "owner": "developer",
      "priority": "high",
      "dueDate": "2026-06-08"
    },
    {
      "task": "Migrate SidePanel component to select from the new Zustand store",
      "owner": "frontend-dev",
      "priority": "medium"
    },
    {
      "task": "Write integration tests for NoteDetail state transitions",
      "owner": "qa-engineer",
      "priority": "medium",
      "dueDate": "2026-06-12"
    }
  ],
  "openQuestions": [
    "Should audio state eventually be moved to a shared Zustand media slice?",
    "Do we need to support offline mode for NoteDetail in the first iteration?"
  ],
  "unresolvedConflicts": [
    "Disagreement over whether tab state should be synchronized with the URL hash parameters for bookmarking."
  ]
}
